ID,Score,Review
385,1,"One of the most overrated crap products on the marketPurchased this product. Don’t bother takes 3 hours to set up, very confusing on how to set up. Once set up the device doesn’t charge. $2399 will be returning. Not worth the money."
386,1,"Do NOT buyI've had this vacuum cleaner for at least 2 years. The first few months it worked brilliantly, but now it cuts out after 1 minute. I'm constantly cleaning the filters. The suction is bad too.
Do NOT purchase!"
387,1,"Bad design, terrible performance, not even with a new filter - DON’T BUY ONE!!It constantly bungs up in places you can’t get to, the filters do not last and we are an older couple and the dog stays outside so our floors aren’t dirty! It’s just a bad design, shouldn’t be on the market"
388,1,"Worst vacuum I’ve ever ownedHad so much trouble with this vacuum. Was at the repair place at two different occasions. Which was very inconvenient as it took over a month to return so I was left without a vacuum.
Third time when it returned I’m sure they replaced the whole machine. But after a few months after using it it lost suction and wouldn’t pick up. I gave up in the end and threw it out"
389,1,Ergorapido vacuum has stopped working at brush rollerthe vacuum constantly clogged up just using it for one small carpet. Now the rolling head won't work the small vacuum does. Had for over 2 years. Do not recommend
390,1,"Terrible product and customer serviceI bought it . With in 4 month its on/off button stop working. I went to Goodguys from where I bought it. At first instance customer service there started blaming me that this fault is due to my improper cleaning and care. They send it to repair in same city where I was investigated and blamed again for fault. I was asked , how many vacume I have at my home. How many time I use it. How much area I clean with it.
They kept on blaming again and again that I was not cleaning it properly. I was titled of giving clarification. After four weeks argues they return it saying that it was just matter of proper cleaning and change of a small rubber valve which was jammed due to dust and they showed me how to clean though I know very well already.
Soon after few days the same problem again, button not working.
Now it was clear that problem was inside vacume not just outside cleaning. Now repairer again tried to fix it but it was not fixable and they have to give new one after a lot of arguments and time consuming.
I will never buy a y product from this company. They just say warranty. But very hard to get warranty cover."
391,1,"Terrible Vacuum, Terrible Suction, Broken Twice within 1 Year & Terrible Customer ServiceThis vacuum is one of the worst I have ever used. The suction is terrible in comparison to my old Miele and with in the 1 year the handle and telescope part of the vacuum snapped. I was able to get the spare part sent under warranty and it then snapped again with in 3 months. This time when I called I was bounced around to multiple people and told even though it was under warranty I would need to take it to a repairer and then inspected and a report written as to whether I could get a replacement or store credit. When I called the repairer they said it may be customer induced in which case they couldn’t do anything unless I paid $65 for a thorough inspection and repair and I should call back Electrolux customer support if not happy. I’m only a little person but I do vacuum everyday. How is it possible that the same part could literally snap twice within 14 months of purchasing. I’m sick to death of the crap quality and time wasting of trying to get my money back or items replaced. Whatever happened to consumer rights?!
I advise you to steer clear of this vacuum and perhaps Electrolux all together as they are unlikely to support you!"
392,1,"Motor burned out within 3 monthsMotor burned out within 3 months of purchase, Electrolux had me take it to an authorised repairer. After 3 weeks repairer still hadn't received parts and Electrolux would not give an ETA on when they might get parts, As they could not guarantee repair in a reasonable time I asked for a replacement or refund which they said I was not entitled to as it was repairable despite being a Major defect.
Very disappointed that Electrolux misrepresented my rights under consumer law."
393,1,"This model is a lemonVacuum cleaner was excellent to start with good suction cleaned all surface very well
But died end of warranty
Warranty team helpful
repairer supplied by Electrolux very distant a 100km round each trip to be repaired x 3 trips to repairer
And I’m not in a country area I live in Brisbane
First repair didn’t fix vacuum cleaner
Returned to repairer under warranty Replaced motor that visit
Motor died 2nd time I used it
Very disappointed with product and convenience of repairer
Wont be buying Electrolux again"
394,1,"Just 3 months out of guarantee and it diedBought from the Good Guy's Robina, and was initially really pleased with this vacuum, good suction and easy to use, but it periodically overheated despite making sure filters etc were clean. Now just over 2 months out of its guarantee it died. Do electrical items have some kind of circuitry in them so they know to break just out of guarantee? Very annoyed."
395,1,"WORST VACUMN IVE EVER OWNED! WASTE OF $440!I bought this vac after reading reviews on here saying it was 'the best' vac for pet hair. I get it home and within the first week, the machine stopped sucking as strongly as it was upon first use, barely picking anything up. I took it back and was given a replacement machine. The next machine I got never sucked as well as the first from the get go, but then it started sucking at the same level, whether set on high or low. Then it started gathering all the dust etc in the top part of the machine and not filtering it down into the barrel, (see attached photo) which caused the machine to overheat and stop. So again, it went back. And with Harvey Norman Product Care, I only got back the replacement value, which is now far cheaper than when I bought it, so now I'm over $100 out and still have no working vac! Will never purchase an Electrolux product again."
396,1,"Lasted 2 monthsBought this vacuum cleaner
2 months ago from Bing Lee and it suddenly stopped working. Filters etc clean, no blockage. No I’ll be wasting time replacing. Not happy."
397,1,"Good Machine Cheaply MadeIt's a good machine built to last for the warranty period only. Bought this last August from Harvey Norman and the handle already disintegrated from the joint one year and a month later. The power cable retraction mechanism is hit and miss as well. Works sometimes.
I loved the Electrolux Ultraone I had before this but after this purchase looks like I will have to move away from Electrolux Vacuums."
398,1,"Poor quality, Low suctionI purchased this vacuum only to find when I opened the box a bent hose and the turbo head would not sit flat at all was very stiff and when I tried to vacuum and I had to keep stepping on it every few seconds to get it to stay down to vacuum it was a loosing battle. Then the hose would totally bend on the bent section of the hose and stop suction. So I returned and got a replacement I could have got a refund but thought it could have been a one off. I was only to find the turbo head is still staying up on the new 2nd vacuum and I'm having to stand on it every 5 to 10 seconds to keep it down and suck, not as stiff as the first head but still wanting to stay up like there's not enough suction to pull it down and the plastic join is just stiff. They said it would loosen up with use. But shouldn't a product work straight away from purchase not wait to see if it loosens up. I'm only persisting with this vacuum as the head is the only one that glides easily (when it stays flat) over triexta carpet. I believe the recycled plastic has compromised the quality and it's way over priced at $599. If the head dosent loosen up after the next few vacuums then I'll be returning it again for a full refund. It's suction at full is only half that of my Miele that I have given to my daughter due to the heads would not glide over my carpet with ease. My recommendation is don't buy this product.
Update 22/09/20: tried to vacuum with it again and it's was a missing battle, hubby the builder had a go and after 30 seconds said return it. The head, plastic hose is so stiff it just makes the job impossible. The vacuum is not cleaning the carpet as the head won't stay flat. I returned to Godfreys Bathurst and got a full refund. This product is made from 60% recycled plastic and it has made a poor quality product. Electrolux discontinue this product please I've had two and both are unusable what are the odds of that."
399,1,"Avoid - Disposal vacuum cleanerRarely used this vacuum cleaner and surprise suprise, after the 24 month warranty period it conveniently doesn't turn on. It's pretty noisy. Be prepared to throw it in the trash after warranty. Support claims there's probably too much dust in the filters and to drop it off at a service centre for repairs. Not buying anything electrolux in future"
400,1,"The joint between brush head & tube crack in less than 6 mthsOverall it is a good vacuum that do its job for both hard floor and carpet.
The wire is very long and the vacuum is light to carry around.

Just surprise that the quality of the parts are so bad that it crack in less than 6 mths.

The wheel is also very bad as I struggle to move it around instead of following me smoothly like the Nilfisk I own previously.

Got a replacement parts after contacting the Warranty department. The replacement arrived within a few days which is fast based on current COVID situation.
The component seem to be a bad design when I compare with my older vacuum which lack of that extra click which I believe will break again soon.

It broke again as per the 2 new pictures."
401,1,Terrible Product. Don't buy !There isn't anything silent about this vacuum except in the name. Nozzle jumps like a frog when cleaning and broke exactly after warranty expired. Cant even replace nozzle as it is discontinued and I just have to throw the vacuum away. Worst ever vacuum.
402,1,"Terrible - (And dont buy from Godfreys)This machine only worked properly for the first few times. It seemed to clog easily - manually having to clean out each of the many cylinders each time. Then it stopped working. (It seemed to overheat like a hairdryer). Because of the pandemic, Godfreys wouldn't fix, exchange, refund. I had to buy a new machine and now I'm stuck. Save your money"
403,1,"NOT silent. Sucks good, until it breaks down. Warranty is FAKEI do not know why they call this silent, it's actually as loud as any other vacuum cleaner. It does suck well. However, motor breaks down at 10 months. Warranty claim was refused. Said it was due to poor maintenance of filters. They expect you to clear the filter after each use or else warranty is void. Basically, they could use this clause on anything. They could even refuse your claim if the motor breaks down on the very first use."
404,1,Worst product I have ever purchased!Worst product I have ever purchased and Electrolux customer care was woeful! Good guys reused to replace it and made me call Electrolux myself to try and get resolution which was a waste of time too. They absolutely didn't care at all.... Be warned and don't buy Electrolux anything!
405,1,"This is nowhere near silentMy admin person bought this about 2 years ago after I said I wanted a quiet vacuum cleaner at work. Unfortunately, it was neither quiet nor a very good vacuum cleaner. To be fair, she was not to know this based on what this machine was said to do.
It was always too loud for me. I could hear it being used through my treatment room door at work. I used to have an Electrolux UltraSilencer and could never hear that through the door- so I will go back to that one. But my admin person liked using the SilentPerformer and she was the one doing the cleaning so I didn't really worry too much. However, now it's just me at work and I'm back to doing the cleaning (!) and this is a very noisy machine, moreso when you use the powerhead. So I use the all-floors head instead. The clean isn't as good, but at least I still have my hearing when I've finished vacuuming.

This is used on carpet and linoleum and tiles. There is probably a fair matter of dust that is walked in by my patients but this machine should be able to deal with that. It used to do a better job cleaning 2 years ago and it only gets used 2-3 times a week on average for maybe 10-15 minutes each time. The suction is getting worse. It doesn't matter if you clean the filters. This machine does NOT last the test of time. It is past the warranty date so I can't do anything about that. I just don't think it's made well. Perhaps being used in a less dusty environment may have suited the machine better?

The extension piece on the wand now gets stuck and is almost impossible to click into place after I finally manage to get it to extend. I am not 4ft tall and I don't want to bend terribly to vacuum! It even has some trouble unclipping at the head unit when I take it off to get into corners. And the back of the head struggles to glide into place on the side of the machine when you put it away now. It used to be absolutely fine to handle - but in just 2 years the ease of use has gone from good to bad.

It's very easy to unclip the dust catcher...but it makes a mess when you empty it. I really do prefer bags. It also overheats. And the cord is not long enough - and pops out of powerpoints at the slightest tug. I really am struggling to find anything good about this machine! Basically, it is NOT anywhere near silent. Noisy, in fact. I have to say, I think they lied about that one (not that I have a sound level meter to check...) but it's always been quite noisy. Now, 2 years on, it just feels like a hunk of junk.

I think a vacuum cleaner should last better than this. And I don't think it should have the word 'silent' anywhere in its name. The only way it's anywhere near vaguely 'quiet' is if you don't use the powerhead and you've got it on very low suction. And then it doesn't vacuum properly anyway! So really, there's no point to this machine. For the price, I've used far better and far quieter vacuum cleaners."
406,1,Best invest in a expensive vacuumHad this vacuum for only a week & already it overheats and stops working for long periods. On top of that it doesn’t clean my carpet as good as my old one (German).
407,1,"Started off greatStarted off as a great unit, I think I have had it a year now and suction is not what it was...I got this after a Hoover I had at 14 months old had the filter come off and block the suction. I am starting to think this is doing the same. How can I get a good vacuum that isn't going to cost me an arm and leg and work for more than a year or two...!"
408,1,"Neither Quiet nor Good PerformerShops urge consumers to post reviews immediately after buying. This is idiotic and I guarantee 90% of the reviews here have been posted within the first month of acquisition. They do this in order to push as many units through the door as possible by people reading 'positive' reviews of goods which have been owned for usually a matter of days.
I have had this vacuum cleaner now for 18 months. It is not particularly quiet; pretty much average as per noise levels. The worst thing about it is that the performance gets steadily worse over the months till when you get to this stage the suction is about nil. The design is poor: the release switch for wand extension has to be pushed up toward the body instead of the more natural movement of down toward the head. It overheats if you try to pick up anything larger than a couple of centimetres and you must allow it to cool down overnight. So basically it does not do what it says it does on both of these selling points.

I would not recommend buying this vacuum cleaner unless you want your life to become an endless cycle of buying a new vacuum cleaner every 18 months."
409,1,"Not too silent for price to payNot too silent for price to pay, this Vac was really good performer till the warranty went on, Literally one day after the warranty finished harvey norman did not want to respond us. First thing they told when we called was to ask us how we have cleaned machine, they asked us to bring machine to store , upon bringing the machine to store. Store always found something wrong with how we have maintained the machine but never bothered to helps us professionally clean the machine. Machine is still the same noisy, low on the suction and unable to perform."
410,1,"Extremely Hard to use this Cleaner on cut pile 100% Nylon CarpetSuction is great. While not a Silent-Performer as Electrolux purports, it is significantly quieter than the noisy Dyson we used to have. The cleaner is VERY hard to push over a 100% cut pile nylon carpet, so that if you're considering buying one for this purpose, then I suggest you chose another brand. Nylon carpet is subject to shading, where the surface appears to be of different shades. The cleaner leaves to track marks over the carpet from the 4 roller wheels on the head, making the inherent shading more noticeable.
Their is no crevice tool provided & the dual-purpose accessory brush/small head provided is next to useless.

When the hose is turned around to change direction of cleaning, it tends to knock the speed controller into the ""off"" position, which is annoying.

In summary. I am very disappointed with the cleaner, and therefore can't recommend."
411,1,"Waste of moneyThis model must have been designed by someone who has never vacuumed. Great to use if you've already done a thorough sweep and mop of your floors. Continually gets blocked by anything larger than a lentil. I find the cord too short, not very easy to manoeuvre and it's cumbersome to pack away. Vacuuming is already a chore and using this cleaner makes it thoroughly unbearable. One star for being made from recycled plastic."
412,1,I'd heard about the on switch problemsI was expecting great stuff after ordering this model. My mother who was a fanatical dutch cleaner who over the years always swore by the electrolux brand. Unfortunately my brand new model won't even switch on. Sooo disappointed .... even more so after talking with the customer help line. They directed me to look for a turn on button on the hose handle. I felt like a fool when i could not find a turn on button on the hose handle but was relieved that another witness also could not see this suggested button as there is not one!
413,1,2nd use shutdownWe bought this due to its size not so clunky as our old one and we trusted the Electrolux brand name. But for 2nd time after 30mins or so of 'normal' house vacuuming when I switch off to move rooms...it won't switch on again! hopeless. Thought due to overheating? But I have 2 floors to clean. I don't have time to let the thing cool down and for $300+ ---I shouldn't have to.
414,1,"Didn't last long !This was purchased as a replacement for a dead vac. It is quite a neat tidy design that does not topple over or turn upside down when towing it around, as many do (Dyson et al)
First comment is that it is nearly impossible to pick it up- there is a handle on top that does not seem to move and traps the knuckles or snaps one's finger nail if you try to use it. I am pretty good with mechanical items but I cannot find how to fold it up.

Second- after the first whizz round the house the brush had a lot of hair ravelled round it and had become wuite stiff to turn. The second use I ran over a Kirby grip (Bobby pin) Suddenly the turbine in the head sounded like a chainsaw. I wanted to remove the brush to clean it but found that it is held by 6 security scews, 2 of which are hidden under the wheels. Then the moulding has to be prised apart with a knife. Just the thing for the busy house person !

The turbine is a weedy little item with single-ended blades. The Kirby grip had snapped one blade off so now the whole head vibrates badly.

The persons that design these things obviously have no idea how they are used in real life. A Kirby grip !What would a 4-spot piece of Lego done to this turbine? Total carnage that's what. This was really the second time it was switched on and used, and I don't have a hope of a warranty return- ""Oh, maam, you should check the floor before you vacuum.

Bring back the Hoover Junior."
415,1,"DisappointedBought a Electrolux vacuum cleaner many years ago and was brilliant. This latest one I can not bag enough. If you don't clean all three filters just about everytime you use it, it has the sucking power of a straw. Sent it back because power button wouldn't work which was fixed. Don't waste your money buy a cheap one from Kmart it will do same job. It is that pathetic I will never buy an Electrolux product again."
416,1,"Worked well for 2 weeks, now uselessElectrolux silent Performer
Seemed good for the first few weeks, then lost most of the suction. Had to pay $60 for new filter , worked okay again for a few weeks, now back to useless. Only a few months old, and not cheap. Expected better. Would not recommend at all."
417,1,"TerribleI have had the indigo and the chilli red , both are terrible . I have just purchased a shark detect pro and it is the best vacuum I have owned"
418,1,"Worked fine for 4 months and then went kaput!I got this from the Good Guys and it worked well for just a few months. Like the other reviews mentioned, the suction stopped working and the unit would turn off on its own randomly. Cleaned the filters, roller etc but it made no difference. Dirt would also fall out of it when you turned it off. The light on the swivel head also stopped working. Pretty pathetic - cost over $300 and only lasts 4 months. Surely this is not right?"
419,1,"Wish I had paid attention to the reviewsI bought this vacuum in May this year. I had the previous model which was still going and needed another stick vacuum. Well, as others have said, all good for 6 months then it stopped a couple of times. I wondered if I had touched the button. But now, a month later, it just stops all the time and is not suctioning. Cleaned everything inside it but that is not the problem. When it stops dirt falls out the foot. Have to turn it on 3 times just to vacuum the ensuite. So taking it back to the good guys. Stay tuned.
Do not bother buying this vacuum! Obviously has a manufacturer fault since others have the same problem."
420,1,"Do not buy this productFull changed battery won’t lasting as specified. They say on low power, battery lasts 50 minutes but it doesn’t.
Low power = zero suction power
Brush doesn’t cut stuck hair/fibre on brush as per specifications but it stops picking stuff the floors, especially carpet area
Very bad product from this brand"
421,1,"id give this zero if i could. do not waste your moneyit would turn off after a few minutes use right from then start. i had it ""repaired"" under warranty within a few months with no difference even though the guy said that it now worked. despite cleaning the hose, cannister, filters.. it makes no difference. it does not even have suction. good guys and electrolux were of no assistance what so ever. a total waste of money. it has been sitting there unused for a year since i got it back pulled it out today to do a quick clean and it does not work."
422,1,"Would not recommend this machine. Do not buy it. No battery replacementRecently bought the machine in Dec 2022. Unfortunately, I was told by the girl at Electrolux centre today that there is no replacement for the battery after the 2 years warranty. I spent $349 on a machine that will only last 2 years. Very expensive to me. Would not recommend this machine to anyone if no battery replacement as it will be useless . Very disappointed."
423,1,"Thought I was getting a good deal!Simply went shopping to buy a replacement for my faithful ErgoRapido stick vacuum, which was still working after many years, but had lost the screw holding the handle together. I was impressed by the stronger suction of the next model up - Pure Well Q7. First time I used it, it kept switching itself off every couple of minutes. Thinking it was something that I was doing wrong, I persevered. Next time I used it I tried vacuuming up some uncooked rice that I had spilled on the kitchen tiles. I noticed that it stopped suctioning after picking up a bit of the rice. Decided to empty the canister - no rice at all in it. The rice had not got past the hose leading to the canister. Pulled it apart and managed to clear the rice from the hose and although the suction returned, the machine kept on turning itself off every few minutes. I decided to return it and go back to my original choice of ErgoRapido and I couldn't be happier. If this one lasts as long as my previous ErgoRapido I will be a very happy person. I have also found that the ErgoRapido is much easier to empty and clean than the Pure Well Q7."
424,1,"Didn't last not even the 12mth warranty periodI use it my car mats, the car boot, the plastic surface under the car mats and to clean the tiled area.
Now there's no suction, it also turns off. Just as I was beginning to like it. I was even thinking of buying one for the tiled area in the house lucky I didn't.
My cheap house vaccum cleaner which I bought for 59 dollars has lasted for 5 years and the Electrolux which is supposed to be a good brand cost more and didn't last 12months."
