ID,Score,Review
157,5,"2 year review - still the best cordless stick for $399I have had the A9 White for almost 2 years and use it daily as the main household vacuum. Far better than my old Vax Blade which was $100 less. Great suction and pickup even on the lowest setting (total 3 settings), very lightweight, quiet, low vibration, battery lasts 20 minutes, filters are removable in seconds (comes with 2 yellow pre-motor plus 1x HEPA top lid), removable battery, wall charging dock and the brush roll never ever tangles with hair. Only downside is the average pickup on hard floors which needs a fluffy floorhead (sold separately). The dust bin is harder to empty when it's very full but you can use the crevice tool to twist and remove the internal metal filter and shake it out, no skin contact with dust.
The other reviews show breakage and weird smells but that's probably user error (how is a weird smell the fault of LG? Open and clean your vacuum) or maybe a bad batch. My A9 is does not have any broken bits, only scratches on the wand and floorhead. Even the battery still holds charge well after 2 years. I use my A9 several times a day, 7 days a week as a main household vacuum on carpet and tiles so much heavier duty than expected and it's still fine.

So after nearly 2 years, the battery hold good charge, the filters have just been replaced due to slight loss of suction and the brush roller head has never tangled with hair or fur. Nothing electrical or mechanical has failed. So overall a great vacuum for $399."
158,5,"This is fabulousI bought this stick vacuum after reading lots of reviews. Our Dyson just wasn't up to it anymore and we had had to replace quite a few parts over time - and some in the early days of owning it so I wanted to get a different brand. I love the tower concept. Everything is tidied away and out of sight. The barrel emptying system is fantastic and quite alarming the first time due to the quick startup and sound. The actual stick does a terrific job on the carpet and has pulled out a huge amount of cat hair, dust etc., even after it was vacuumed using an upright. It really is great. My husband loves using it. I bought one for my daughter as well and she also loves it. We have had a few months now and still haven't used up the first bag in the tower so they must hold a fair bit. Anyway, we love the effectiveness of this vacuum. Fingers crossed it continues."
159,5,"Needs better hard floor toolExcellent vacuum especially with my back except it scratches glossy tiles when using on hard floors with hard floor tool
Can LG improve this tool so that only the roller makes contact across tiles and not click clack and possibly scratching tiles?"
160,5,"Love the A9. Hate hurting my fingers on battery removalBattery is too hard to change. Beware if you have long finger nails! Can barely press the buttons to release battery. Need butter knife something to wedge in to pop off battery.
My acrylics ripped nail off"
161,5,"Only wish I’d bought it earlier!Very happy with my purchase! I use it multiple times daily mostly on laminate wood flooring, one room with textured tiles, and carpet in the bedrooms. Great battery life, it’s not run out on me yet (modest 3 bed home).
It’s very quiet, however that’s no indication of the performance. It’s better than anything I’ve owned previously and no longer require a corded vacuum. The design and features were very well thought out; From every attachment having a place on the tower, to the vacuum heads that reach right to the edges. I find it performs well on every surface and is very easy to manoeuvre around the home.

The mop attachment won’t replace my regular floor cleaner but it’s so convenient for spot cleaning smaller spills or mud tracked in the front door and still gets a work out.
It’s also very easy to pull apart and clean as everything is designed to come apart easily. The auto empty feature is convenient and the bags last quite a long time, although I have found it does produce a dusty smell after use.

Overall I’m incredibly happy with the purchase and highly recommend to anyone who will listen!"
162,5,"Great product!This product has changed my life. With two young children, it's made cleaning so much more manageable. Having the option to simultaneously mop and vacuum has been an absolute winner here with floors being done in virtually half the time! "
163,5,"Cleaning out the brush headCan you open up the head of the nozzle unit - the red one designed for cleaning animal hair? The bit with rotating brushes. Mine seems to be jammed, probably hair, can’t work out how to clean it out."
164,5,Has performed well for the last 9 yearsIt has been the best and quietest vacuum we have owned. It's unbelievable how much it gets out of carpet you think it's already clean. We replaced all the filters about 3 years just for hygiene and still working like the day we got it. Every now and then it gets a bit pedantic with the shelf clean so we wash the filter with cold water and a scrubbing brush and it works fine again after letting it dry properly.
165,5,one of the best & quietest vacuumsThis is a powerful vac. The only problem is that it's over pedantic on cleaning itself to maintain maximum suction. It can be frustrating waiting 10seconds for the cleaning mode every 1 to 2 minutes when trying to clean a quick mess. It is however strong and very quiet.
166,5,"Best vacuum ever!This vacuum cleaner has been an absolute power horse. Not only have I had no issues with it mechanically, this vacuum cleaner’s performance at picking up dust and dirt is second to none. I had a Dyson before it, and hands down the Bosch does a better job at picking up dust and dirt and other things from the floor. The suction is always super strong, even when the bagless filter is near full. I’ve had it for nearly five years now and cannot fault it. I will definitely buy another Bosch vacuum over Dyson any day! The Harvey Norman salesperson I bought it from was desperate for me to buy another Dyson and didn’t even show me the Bosch. When I spotted it as an alternative to Dyson, the salesperson really tried hard to brush off the Bosch and convince me to stick with the Dyson, which only made me want to try the Bosch even more, and boy am I glad I did! Thank you Bosch!"
167,5,"Best vacuum clear, strong and quietIt has been worked for me 7 years. I’m looking to buy same one. Strong suction and soooo quite. I vacuum while my baby was sleeping. You won’t regret with this vacuum cleaner"
168,5,"Awesome!Super quiet, quality build, great suction... I bought this 2nd hand and missing the main hoovering attachment... So I bought a universal carpet attachment and haven't looked back! I've heard all the horror stories about this same model turning on the ""Self cleaning mode"" almost every 5 mins etc but I've had zero problems.. Maybe its all about the universal carpet attachment I bought as this one's got greater airflow than the stock Bosch one? Greater airflow = less ""Self cleaning"" sensitivity to blockage /Air restriction issues which activates the cleaning mode? Regardless its been a perfect vacuum cleaner..  "
169,5,"Powerful performanceWell engineered and very powerful. We use it on carpet, tiles and floor boards. The power head attachment is so easy to clean due to the cleaver - easy to remove brush head. Only small criticism is the power head stalls / slows down sometimes as it is driven from the suction of the vacuum rather than its own motor in the head itself. The self cleaning filter is brilliant as I always forgot to clean our old filter. Huge bag less compartment which is easy to empty and reinstall. Very happy."
170,5,"Very powerful and very quiet, but not perfect-=The Good=-
The first thing I noticed using this was how AMAZINGLY quiet it it. With the suction turned to the mildest level you could easily carry on a conversation without even noticing that the vacuum is on. You can have a coherent conversation even with it turned all the way to max (although obviously, it's louder), so it's ideal if you want to do some late-night vacuuming or generally hate the din of a noisy vacuum, or don't want to disturb people in a neighbouring room. I must say, having a quiet vacuum genuinely makes vacuuming much less of a chore, something I really hadn't thought of before I owned this unit. It's probably pretty good news if you've got pets or younguns that are terrified of vacuum sounds too.
The second thing I noticed was how crazy powerful the suction is compared to my old beater. I initially made the mistake of using the Parquetry head on a rug - it sucks so powerfully it will carry the rug with it, even when dialled down to half-suction! But more impressively, when you use the correct head (the carpet head) even on maximum suction it will easily glide over rugs and carpets giving them a good deep clean. The quasi-motorised carpet head also does a great job of picking up hair from carpets, and they have made it easy to clean the hair roller by simply removing it and cutting the bundled up hair with scissors, and you can remove it all in one go. Not sure how it would go with shorter animal hair, but it does a great job with long human hair. These little self-maintenance additions are sure to extend the useful life of the vacuum.

It comes with all the specialist attachments you could use, and even has a hybrid one that you can switch via a foot-lever from carpet-mode to parquetry mode; and has an attachment to the stick that carries the crevice tool and the upholstery attachment for portable convenience. The parquetry head works impressively well on hardwood floors - it will even pick up thin films of dried out mud, owing to the bristle action. All of the attachments are easy to attach and remove with quick-release catches - you never need to struggle wringing the thing back and forth to take an attachment off. It has two different mounts for the stick for when the vacuum is not in use - one with the vacuum in normal position and another if you wish to stand the vacuum up in a closet or some such. The hose is a high-quality nylon fabric hose and you can see by it's girth that this thing sucks a lot of air if you dial up the action.

It's easy to clean the debris compartment and also pretty easy to clean the filter if you wish to do this manually - I've done it by removing the filter and hitting it with the leaf blower and also compressed air, which works even better; however it has an auto-clean function built into it which will rapidly vibrate the internal dust filter to shake debris from it. This function can be enabled manually but apparently will also operate automatically if the vacuum detects poor suction (although in 6 months of use, mine never did it automatically).

-=The Not So Good=-
1. It's a bit on the heavy side which might be an issue if you're frail or you need to lug it up and down a staircase, but won't be for the average user or anyone with a house they can just drag it around in. I feel the heaviness results from a generally solid build quality; I've had cheaper, lighter vacuums but the plastic always ends up breaking apart on them.

2. I recently encountered a massive loss of suction from my unit which had me stumped for a few days. After pulling it apart, cleaning everything obvious the issue was still there, even with all the hoses cleaned out and filters freshly cleaned. Through a lot of experimentation I figured out the motor is still sucking like Tony Abbott as a PM, so I was almost out of ideas; and through chance I discovered that if I press upon the unit while it is turned on, the suction suddenly returned - turns out that a circular rubber gasket had gone missing from one of the suction ports above the debris container. This gasket is not indicated at all on the Bosch website as a spare part - although it's larger neighbour gasket is listed. So I took a trip to Bunnings and Macgyvered up my own gasket using some tubular self-adhesive weather seal (for $11), and bam - back to 100% suction again.

I had noticed that particular gasket came loose earlier when I was emptying the debris, and probably it happened again to someone else who emptied it and it went out with the trash. So I'm hoping they will send me a replacement and this time for good measure I'll probably glue it in place. I would have given it 5/5 for build quality if it weren't for this issue; everything else about it feels sturdy, built to last and built for regular use.

-= Conclusion =-
I genuinely love this vacuum, and it's worlds better than the cheapies I have owned in the past. The support from Bosch on the missing gasket has so far been very good; I was basically offered an entire replacement vacuum, but since I REALLY needed this vacuum to work to cleanup after a party I temporarily fixed it myself. Hopefully they still send me the gasket. It's not a cheap vacuum, but I feel I got what I paid for."
171,5,"Just awesome & very quietI have never thought that it might be so quiet vacuum cleaner. I was simply shocked when I switched it on for the first time.
Using it on tiles and carpet with no issues.
Washable container is very big -- perfectly fit our house. Vacuum is also big so might be not very handy for someone.
Long power cord is good addition. And cord's retractor works fine.

A bit expensive. We expected to buy something cheaper at the beginning. "
172,3,Not impressed at allDoesn't have a suction my previous Dyson vacuum cleaner had for half the price with a cord. The battery looses power very quickly. Quicker than what the item is designated to do.
173,3,"Not as good as the older modelsI brought the new Dyson V15 vacuum cleaner with high hopes it would be as good as the previous model. I was very disappointed as it doesn’t pick up small items as good as it should also the suction is very poor. Would I recommend this product no, would I buy another Dyson vacuum no I wouldn’t"
174,3,Laser just a gimmickIf you have alot of natural light in your house you wont even see the laser. Much prefer my outsize
175,3,"Disappointed no suction using crevice tool on Dyson V8 absoluteWhen using crevice too or dusting tool there is no suction it won’t clean out around window frames and doesn’t get dust off skirting boards, this is most disappointing to me."
176,3,"Not the best but far from the worstGreat vacuum for smaller tasks, eg quick carpet cleaning, floating floors or car cleaning. Not great for bigger projects. Batteries are a serious issue but can be easily replaced. They have a great wall mount with easy charging but it seems if you leave it on 24/7 it effects battery life."
177,3,"Average and disappointingMy 6 year old Dyson V6 died and the customer service to sort this out was great. They couldn't fix it so offered me a very good deal over the phone for a new V8 with all the accessories instead ($400).
Overall this is ok but very disappointing for what I would expect to be a considerably better vaccum cleaner.
In short, normal suction is very poor and often not enough to clean some basic things that you would think it should. The more powerful ""Max"" mode does the job which is fine but it only last 7 minutes. This means most of the time it lasts 7 minutes but then needs almost 6 hours to recharge before I can use it again - VERY FRUSTRATING!
I got this for a reasonably good deal but it's not even worth the price I paid.
Easy to set up & use and normal run time is ok but I need to use ""Max"" mode all the time so it only lasts 7 mins!
Good power head & accessories (but previous accessories from previous model won't work on new models)
Lightweight & easy to handle
Fairly low noise for normal use but ""Max"" mode required almost all the time is the usual loud noise"
178,3,"Great when it worksGood suction, love the cordless aspect however it worked really well for 6 months then the battery died, replaced the battery. Then it only worked for 1 to 2 minutes even tho fully charged.. wouldn't purchase another one."
179,3,"High hopesI had really high hopes for this product but unfortunately it didnt pass the check. The battery dies extremely fast and isn't strong enough. Would only recommend for small places with light dust, not a whole household."
180,3,"Poor battery lifeLike other reviewers, I can only get 10 minutes of battery life on carpet, on high setting with a fully clear dust/fur catcher. It is still only 6 months old. This was bought for us as a gift due to our Dyson Cinetic Big Ball Animal Plus having inadequate suction to remove dog hair from carpet. Unfortunately 2 strikes for Dyson......... you know the rest. Such a shame when a product fails to deliver on its brand promise!"
181,3,"Not happy with Dyson advanced V7Purchased the Dyson Advanced V7 stick vacuum approximately 15 months ago & I find it won't keep charge for very long, gets blocked easily, having to empty it more often than not, poor quality compaired to the V6 animal, which did a good job lasting me over 6 years without a problem, plus you need to buy extra parts for the V7, as the V6 parts will not fit V7, does a quick vac, but forget dog fur, it gets stuck in the top of the stick all the time, would not buy again, will buy a different brand next time"
182,3,"Some design flawsWhen we bought this stick vacuum cleaner, we were told, it performs on hardfloor as well as on carpet. Unfortunately, this is not the case. We use this vacuum primarily for vacuuming litter around our litter boxes on a tile floor. You have to go over the same spot 2 or 3 times to get everything. Where it shines is on our pet futons, tablecloth and beds. It removes the pet fur very well. We don't have carpets on our floors, so I can't comment on that. But I suspect it does a good job on carpet as well. After vacuuming you have to be carefull, not to tilt the dust container to much to the front. Especially the solid, hard parts will fall back out of the cleaner. Lighter parts, like hair or fur will remain. The handle of the vacuum could be a bit more ergonomically designed. After cleaning for a few minutes, my hands start to hurt. Noiselevel from this vacuum is also quite high, without using even the turbo setting. The battery life, I think is sufficient. You don't use this vacuum as your main vacuum.
All in all, I think there are a few flaws in the design, but nothing which makes it unusable."
183,3,"Love the design but doesn't always 'suck'I have always been a fan of Dyson but after a few months of using the V7 cord free, the suction is slowly diminishing. ( Yes I clean the filters monthly) it is like the battery and suction system start to work less over time which is a shame. Positives are that it is completely cordless and doesn't take long to get to a full charge but I am now having to use it on the higher suction option which doesn't last anyway near long enough to clean my whole house."
184,3,Love itGreat little thing but battery life sucks doesn’t last long
185,3,"Handy vacuum for quick spillsGreat little cleaner.
The vacuum is great on hard services. We have wooden floors and tiles. The suction is very decent, but cannot suction going in reverse which isn't the best.
Battery charge is great, can do the house if needed, but need to empty the tub more often. This vacuum is great for quick spills and the kids love to use it - they will argue to use it which is great :)"
186,3,DISAPPOINTEDRecently I purchased the Dyson V7 stick vacuum cleaner. After fully charging it I cleaned my wooden floors and I am disappointed with the battery life as it lasted about 15 minutes.
187,3,"It's okay for a yearPurchased this bacuume In 2020. Second Dyson I've had and to be honest they just don't live up to the hype if you actually want clean carpet. Very neat assembly, not heavy, can manoeuvre. Neat little kit goes on the wall. However after 2 years the turbo will drain the battery in 5 seconds and after 3 years the battery life will halve, as will the suction power. The brushes on the foot wear down to nothing and you are forever untangling hair. I personally will never purchase another Dyson. I will invest in something that lasts longer."
188,3,"The main filter had issues after 3 monthsThe machine automatically stops. Dyson gave me a new filter. Literally, the main part of the machine can not work properly.
Hope the new one will last.

Suggest not buying this model if you can avoid it."
189,3,"Has it's faults for 1000 prototypesBought it a year ago, like others it has it's issues that drive me nuts.
First, there is 9 joins in the hose! after some wear and tear the joins become lose and ammit a high frequency sound, I've had to tape them up to shut it up. Second, the tab on the fill container broke. Third, the power switch has no grip so your finger and foot slides off without actually turning it on. Forth, when flicking out the brush for hard floors instead of sucking up dirt ect it just pushes it away. Way to many bristles.
Other than that its ok but i hate using it."
