ID,Score,Review
266,1,"worst vacuum cleaner ever owned!keeps cutting in and out.
vacuum dust bin is way too small and only works when totally empty.
charging base is too loose and needs a piece of cardboard sat underneath the unit to sit it up and charge it, or the actual charging point doesn't reach.
worst vaccum cleaner ever owned, don't believe the hype!"
267,1,"Terrible vacuum cleanerI was told buy a Dyson it will change your life, what a disappointment.
Purchased as advertised great for animal fur/hair. Underwhelming and not worth the cost, after 3 years of disappointment I’m heading to another brand that works as is advertised."
268,1,Dyson V7 overpriced junk!!!This cordless vac cant even clean a 2 bdrm appartment before its battery runs out and takes hours to recharge. It also does not pick up lots without going over it from different directions a dozen times. A better real vaccuum cleaner with cord leaves this piece of junk for dead!!!
269,1,"The worst customer service I have ever come across!!!!I bought the v7 2 years ago I've had so many problems with it I've been in the phone with customer service for hours on at some times trying to fix the problems they've sent out different parts for the issues just to shut me up instead of replacing it because clearly there's a fault, so last night the vacuum made a loud explosion like noise and fire/ smoke was coming out of it and when I emailed them and told them they didn't care at all to ask about my well being or my children who have asthma and if we are ok instead [Names Removed] who's supposed to be the highest manager for Dyson said yep we'll asses the problem and you need to pay for the repairs after the vacuum Basildon exploded on me!!! Wowwwwww I'll be taking them to court."
270,1,"Battery fails to hold charge, I’ll never touch Dyson againWell, Dyson have completely screwed the pooch with this latest ballsup of a product.
I must have purchased it a few years ago now, but it fails to hold charge. I wouldn’t have used this more then 100 times, if that. Modern lithium batteries are meant to last 300-500 cycles, so there’s no excuse.

It runs for about 10 seconds, from being plugged in for hours “charging”. If I plug it back in and charge it and the. Use it immediately, it runs as expected. So, it clearly has a drain problem within the circuitry. Who designed this??? They need to be fired.

What blows my mind is that, in the past, Dyson had a good reputation for quality durable goods. This product is far from that. Clearly they’ve used inferior parts, and haven’t done the basics of quality control. A total opposite of what this company is meant to represent.

Many reviews on here state the exact same issue.

Due to this, I’ll never, ever, buy a product of theirs, ever again. Did I say ever enough?

Good work Dyson. You’ve screwed yourself and all your customers in the process. Goodbye. You’re dead to me now."
271,1,"Great at marketing , Equally worse at quality and supportBought this product and before the warranty period it's falling apart. After parts replacement by dyson still not workable and it good looks as a trophy at home."
272,1,"Can't Even Get Hold of Dyson On the Phone!My Dyson V7 has been frustratingly breaking down for a few months now, running for only a minute or so.
Have been trying to call Dyson to effect warranty however, the calls keep failing!, tried again and again, hopeless, a waste of my time! I am reading on reviews it is likely that the battery needs replacing and then when the battery is replaced its none the better. Dyson, what are you doing? Answer your phones!"
273,1,Appalling deviceUsed daily. Battery failed within warranty period. Dyson replaced the battery which again failed just outside the warranty. They are obviously using low grade lithium batteries. Not acceptable for such an expensive vacuum.
274,1,"Dyson v7 stick vacuumI purchased a Dyson v7 stick vacuum 2 years ago, I would never buy another one. According to their website the battery takes 3.5 hours to charge and gives 40 minutes of powerful suction. I could never get mine to last longer than 25 min on the powerful suction mode. If on Max suction, it lasts 10 seconds - I timed it!
The powerful suction mode is not powerful, useless on low pile carpet, only reasonable on tiles as the suction will not pick up everything. I get more suction from a B&D Dustbuster. Very disappointed in this product."
275,1,"Disappointed!Have had many Dyson handheld models over the years but first time one hasn't come with a crevice tool! $400 dollar machine and I'm supposed to now pay more for something that almost every other vacc brand comes with standard - poor form....
Plus this model seems to have an unnecessarily harder bin empty mechanism (esp. for those with elderly or weaker hands)."
276,1,2years old replaced battery 3 xI’ve replaced the head with a soft head which is much better on hardwood floors. I have also had to replace the battery 3x. I wouldn’t recommend this vacuum to anyone.
277,1,"Battery started to playing around as soon as it is out of warrantyI had the same issue with the Dyson v7 battery before and Dyson replaced it as it was under warranty. The new replacement battery comes with 2 years warranty and the same issue happened with the replacement battery too. Its my unfortunate that this happened as soon as the 2 years passed. Now, they want me to pay $129 for the battery which they know has issues. The same issue happened to 2 of batteries that means its manufacturing fault. When I approached Dyson they wiped off their hands by saying that its out of warranty and we can't do anything. I tried to make my point that as per ACCC rules, based on the cost of the product, it should last reasonable time even after its warranty period.
Dyson wants me to pay $129 after every 2 years as soon as the battery is out of warranty as apparently, this issue is with battery manufacturing process.

ISSUE: The machine stops working even if it is fully charged, then the machine has to be connected with charger for 1 sec in order to use it again."
278,1,The Dyson V7 works well BUT the battery is rubbishWe have had a Dyson V7 and although the machine vacuum works very well the battery is absolute crap. This is the second Dyson battery operated appliance we have had and it will be the last.
279,1,"So not happyA full charge only does 15/20 mins at the most , cuts in and out all the time , ive had 3 dysons and keep saying i will never have another ."
280,1,"Once a great company, now terribleLike so many, owned for 6 months before it started to clog up and cut out regularly (every 5-6 sec), pulled it apart and cleaned thoroughly, only for it to continue. Contacted Dyson, who ask for video evidence. Once provided, send out a new replacement battery. Which does nothing, problem still exists... so now we're waiting for a completely new replacement body that I'll have to take apart. They advised 2-3 weeks for the part, after this time passed another SMS to say the same length of time again. SMS states respond with any questions... except they don't reply. Why offer? Why not say, unmonitored?
Dyson won't acknowledge the problem, or replace the whole unit. They used to be a reputable brand. Not worth the money!"
281,1,"How to fix a DysonBadly designed and badly made:- not worth the huge price. They break and are expensive to repair. If they were made properly there would be no need.
Watch my video:- https://youtu.be/T3cYB4ScEuY?si=Agii7dvd99MF37uY
Purchased in Feb 2020.

Product is used: Several times a week
Pet Owner: Yes
Floor Type: Carpet"
282,1,"Expensive vacuum, many problemsWithout a doubt the worst vacuum I've ever owned. Constantly stops while vacuuming, gets clogged easily, and struggles to lift even small bits of kitty litter off a very low-pile rug. We got this to replace our V8 and it has been worse in every single way.
We use this vacuum on:
- hardwood
- low-pile rugs
- low-pile carpet

It is equally mediocre at all options. I've never used a vacuum that randomly switches off while using it, but that is the constant, tedious experience I've had with it. The vacuum will simply stop running until you release the trigger and pull it again. No amount of cleaning or battery re-seating fixes this.

The design is also extremely prone to clogs. We use it to get pet hair from a cat and a small dog, and it regularly gets clogged in the outlet in the chamber. I've had to stop, reach in, and physically remove buildups with my fingers."
283,1,"Don’t waste your money on a dyson stick vacuumV10 absolute Rubbish. Don’t waste your money. My daughter tried to warn me that they are [Content Removed].
I have owned 2 Dyson barrel vaccuum for 20+ years they are great.
My Aldi Robovac is 10000 times better."
284,1,"Dont buy a Dyson Stick vacuumBought 8 months ago, motor has been replaced, battery has been replaced, now waiting 4 weeks for a new charger. Have rebuilt it bit by bit. Been out of action 7 weeks while waiting for parts."
285,1,How the mighty have fallenThis vacuum was amazing to start with but quickly become terrible. The original battery lasts less than 5 minutes on turbo mode as the medium mode was insufficient to collect small debris. Eventually died and was replaced only for the same thing to happen again. Now it cuts out after 20 seconds and medium power only pushes the mess around on the flood. I need to sweep before i vacuum and anything bigger than a grain of rice is left behind. After reading multiple threads of people complaining about the same issue i feel like i have been ripped off. Unfortunately Dyson are now all hype but fail to deliver better results than a cheap corded vacuum. Its no wonder thy are now always going on sale. Spend your money elsewhere.
286,1,"False promotion - 5 minutes run time-reallyDyson and sales people ( Harvey Norman) should warn everyone up front that run time on a (brand new) machine is only 5 minutes! Why should a potential customer not assume that it should run for a reasonable amount of time and why should I know that its a question to raise ( assuming that an honest response will be forthcoming? When I buy a stove - I would'nt ask whether the baking temperature goes beyond 100 degrees!
I bought mine yesterday and was cleaning my not too messy car and it died after 5 minutes.
An !expensive mistake"
287,1,It is not worth itI’d had this about 2 and a half years and at first it was great but then it started to not pick things up. I clean the filter and it still does it. I have to go over a crumb 5 times for it to pick up. For $900 it is NOT worth it. A terrible vaccuum. I have to sweep after I vaccuum.
288,1,"Problems after 2 monthsWhile at first I was extremely happy with the suction and hair not getting tangled in the head, after 2 months the vacuum started cutting out constantly. The filter and canister have been cleaned and there is no blockage. Very frustrating to have what could be a great product fail after such a short time. Online research suggests this is a common problem - one that I wish I was aware of prior to purchasing."
289,1,Dyson The worst everDyson The worst ever This vacuumed is by far the hardest and the worst vacuum i have ever bought It is very hard to drag around the house /heavy to pull and to use I have wasted my well earned money buying this primitive machine I bought this 2-3 weeks ago and have struggled to use it all 3 times The lead is short and have to keep un plugging it and plugging it in every room it reaches to do one and a bit rooms at a time Changing the tools is not easy in any way the original tube shaped hover was much better in every way this will be on ebay soon but i think it will be hard to sell even on ebay I WILL NEVER BUY A DYSONEVER AGAIN
290,1,"A struggle to useI bought this vacuum just over 12mo ago with such high hopes being a Dyson.
We wanted a powerhead since we have long haired dogs. The hair tangles badly around the roller (need to use scissors to remove) but there is no loss of suction. Bonus.
Im on my 3rd roller brush since the brushes wear out and no longer brushes my carpet to pick up the dog hair. Replaced under extended warranty though. Bonus.
The roller balls fell off the wand after collecting hair that there was no way for me to access to remove. The entire head was replaced under warranty. Bonus.
The cannister holds heaps of dirt but over time is an effort to get shut after cleaning and once or twice removing it from the machine to empty has resulted in a giant mess and more vacuuming. Bonus.
The suction is amazing. The best yet, right up there with my previous Shark. Picks up everything, even leaves the dogs walk in. Although sometimes the roller pushes some items away and you have to chase them and put the vacuum head right over then to pick them up. And the downfall of having a powerhead that can't turn off its that you suck up anything with a pile and can't move despite having a suction reduction trigger. To vacuum mats I need to take the powerhead off and just use the nozzle. Bonus.
The machine itself is heavy to lug around, doesn't turn well and has sometimes driven me to tears, esp when I bumped and chipped our freshly painted wall tugging it in frustration to get it to move. Bonus.
Trying to clean cobwebs off the ceiling or dust from vent covers is also an ordeal. The hose is simply not long enough nor flexible enough. Just love that the machine rights itself. Bonus.
Well, we're going to try yet another vacuum to see if we can find something else that actually suits what it's marketed for.
I don't recommend this machine if you have long haired dogs (or kids) or any carpeted surfaces."
291,1,"Clogging, looses suctionVacuuming carpet the Dyson looses suction after about 2 minutes , I then empty the waste container clean/wipe around the metal filters with a damp cloth and away it goes for another 2 minutes, very frustrating"
292,1,worst vaccunm do not purchasei purchased this approx. 3 hours ago rom big w as my Dyson origin which is 7 years old finally died. I thought i wouldn't go wrong with purchasing another dynos. well how wrong was i!! it does not suck anywhere near as good and i am in shock that Dyson has actually produced this with such a large price tag. please don't purchase. ill be asking big for a refund tomorrow alternatively contacting Dyson direct.
293,1,"Worse vacuum everDyson should be ashamed, worse vacuum ever. If you have carpet do not buy, it has these little wheels on the vacuum head which digs in and causes havoc to the carpet. It also Doesn’t even vacuum hair up on carpet. If you also want to quickly vacuum a corner by taking the head of the vacuum there is gap in the hand piece (designed by someone that’s never done vacuuming). Do not buy unless you like being frustrated."
294,1,"Dyson quality has gone down hillI own multiple Dyson products but this one is by far the worst. Dyson cy22 animal pro…. Has just not lasted. The vacuum has continually lost suction, unlike my dc39 this vacuum does not have the option to clean the filters and I constantly have had problems with this model. Turbine brush stopped spinning and I’m not impressed at all. I have had a v6 dyson stick vacuum that has worked for years and now have a v8. This one however has been the most problematic of all the dyson products I have purchased…. Really disappointed"
295,1,"I just can't Believe that Dyson actually produced this Vacuum!!!Well I purchased this Vacuum Cleaner (Dyson Cinetic Big Ball Multi Floor Extra) back in February, 2023. I have to tell you that I can't believe that Dyson actually produced a vacuum cleaner like this one!! It is Terrible!! I have a Dyson Gen5 Detect Stick Vacuum that I use around my home - and it is a pleasure to use. Not the case with this Barrell Vacuum!! I purchased it from Dyson on EBay. I bought it mainly for 2 reasons. 1. To use to vacuum my car, and 2. to vacuum the carpets in my 3 bedrooms.
1. Trying to use it to vacuum my car is a nightmare. It never stays upright and always rolling over on it's side. If it hits the power cord it just won't move and you have to tug at it to get it over the cord. The handle design is an absolute pain to use - Dyson put so much into their Development of their products - and they come up with this design?? Trying to clean the dashboard of my car becomes impossible due to this poorly designed handle!! Trying to extend the tube to increase the reach needs help from a weight lifter - another poor design feature. The wrost part about this machine is the excessive cost of all the accessories. They fit in one way only and this is like a jigsaw. Definately not designed for an older Australian User.
2. I have tried many times to use it to vacuum the bedrooms in my home. It's like having a workout everytime that you use it. It requires so much pressure and does not ""Glide"" over the carpet like it should. My carpet is low pile so it shouldn't be an issue but it surely is!!

Without any exaggeration, this is by far the worst Vaccum Cleaner I have ever owned.

I am so disappointed with Dyson. I honestly can't believe that they produced this poorly designed and very frustrating vaccum cleaner!!

Buyer Beware. Purchase it at your own risk!!

Does Dyson offer Great Customer Service? Well I will wait and see - and then report back to you!!

Thnaks for reading ......."
296,1,"Hands down the worst vacuum I have ever purchasedThis thing flings dust and bird seed behind it, in front of it - EVERYWHERE!! Takes me 4-5 times as long to try and vacuum something.
Clunky and awkward head and handle. I have tried the two supplied heads and swapped to a turbo head. Avoid!
I will never buy a Dyson brand again"
297,1,"Not ergonomicThis vacuum does the job in terms of removing dust and debris from various surfaces. But the ridiculous handle design has given me the worst RSI. I'm in so much pain after using it only twice to vacuum my 3 bedroom house.. I couldn't even cut slices of cheese after damaging my wrist vacuuming in such an awkward position. A friend of mine experienced similar and now has a lump on her wrist!
There were other issues, like the flimsy extendible tube and the bulky head. But the pain from holding the handle is enough for me to get rid of this machine.
So disappointed."
298,1,"DisappointingWe have had this model's baby brother for a long time until the handle trigger cracked and duct tape was successfully used to repair. We replaced it with this Big Ball model, expecting the same or better performance. Wrong. The main body does not roll, you have to drag it behind you. Fluff and lint on carpet has to be picked up after you have vacuumed the area. Hopeless. I do like the easier chamber emptying feature and the quieter motor."
299,1,"Works till it doesn'tI have solid hardwood flooring so this vacuum get very little use. I bought the extended warranty. About 2 years ago it started blowing out dust on startup. I ultimately sent it in for repair. I got it back and it was still blowing out dust on startup. For the amount of money I paid, I expect much more.
Very disappointed..."
300,1,"Big mistakeAfter living with and loving the first dyson for many years before I was forced to retire it, I bought the new dyson cinetic big ball animal pro believing it to be a new and improved model...improved no way!! The attachments are awkward and time consuming to use, the spinning brush head bristles broke off and the 3 in one multi tool is ridiculously awkward to use and hair and fluff etc gets snagged on the many joins up the pipes and brush heads. The plastic body & barrel are flimsy and fragile and changing attachments and pipes take forever to slot together...what a disgrace! Saw 2 dyson vacuum cleaners in a charity shop 4 sale last week & they were still there yesterday...go figure!"
301,1,"Disappointing and useless since day 1Today the rewind died. Dyson service - no after hours - Chat does not work.
Vacuum is a few years old has been used about 125 times. Has never been any good on carpet.
Difficult to use/empty/noisy/and ineffective.
I have a Sanyo vacuum retired to the garage and it is over 30 years old and works perfectly. I am on my third Dyson hand held - which is why the “Big Balls up” has had little use. The hand-helds also die. Fantastic that other brands now make similar vacuums to Dyson.

Being creative, stylish, great for those who “look good” early adopters paying for the most expensive product and getting the hired help to use it - that is the Dyson target market. Not so great for those who thought they would get a superior product. Guess you pay for a Porsche/ Ferrari /Mercedes etc you expect a superior product - in Dyson’s case you do not get that."
302,1,"Unreliable careless serviceSince the day I purchased it has issues one after another. Recently suction wasn’t working and I asked for replacement and even opted upgrade. But agreed only for repair.
Finally I received the vacuum cleaner after the defect fix. I sent as a new machine, now after the repair it’s full marks and scratches.

Moreover, the machine so heavy that I started getting back pain after 30 minutes of carpet cleaning.

I’ll never buy their products"
303,1,"Dyson Cinetic™ Big Ball Barrel Vacuum , poor design & functionalitySo after 40 years of being a cleaner & using a variety of vacuums in my work and home I finally got talked into a Dyson by the salesperson. Instead of doing my usual research before buying and reading reviews I got talked into buying it in October 2021.
It is not til you get it home and use it that you realise how bad the design is. The head for carpets/rugs is about the only thing that works ok.
The head for floors is of poor design, the openings come out sideways and everything gets clogged up and you have to constantly unblock. This is a vacuum designed to deal with dog hair & the reason why I thought it would be a great buy. Heaven forbid you pick up anything like a leaf or you spend ages trying to unclog it. I have never had an issue with all the $300 vacuums I have bought in the past.
The On/Off button and retract cord button are very flimsy & unlike all other machines I would not use my foot as I believe they would break.
The worst thing is the chamber for the dirt, it opens ok but trying to close it took me ages to figure it out so that the bottom didn't open up each time you tried to remove it from the vacuum. All parts of this seem flimsy and likely to break. Trying to clean the filter is a nightmare, all my old machines I could wash out but this one I can't.
The wheels are badly designed and struggle to even go over a cord. Again a problem I have never experienced before.
After owning the $850 vacuum for only 8 months it stopped picking up and I took it back to the place I purchased and I had Concierge coverage, they took it for a service. This took 5 weeks & I fortunately had my old machine (that was still working fine) to use. Again I have NEVER needed to service any of my vacuums in the past.
As you can tell I would never recommend this vacuum. As you can probably tell.
Picture below so you can know what not to buy."
304,1,"Great Vacuum- until the NON EXISTENT FILTER needs replacingThe vacuum itself has been fantastic on hard floors with pet hair- until yesterday when the filter the vacuum is advertised as NOT HAVING has decided its full. Google searches later, I found a great video on replacing the post assembly filter that supposedly does not exist, however because I brought with product care I will need to get this done through a supplier to not void the warranty. My issue here is not so much the filter, but instead Dysons false advertising with the product itself, plus the absolute bother and cost to get the filter replaced every 12 months- had I have known this was the case I would have spent $850 On a vacuum that didn't have the long term costs involved."
305,1,"Further review of Cinetic Big Ball Animal cleanerI wrote a critical review of the cleaner when I purchased it in February 2022. Nine months later my impression of the cleaner has not changed. To empty the cleaner is an ordeal - there is always a mess, the component parts are difficult to connect. Help from Dyson recently with a problem was non-existent. I have had Dyson products in the past and have been pleased with them. Because of my experience with the current product I am critical of the company whenever I can."
306,1,"Waiting 5 months for a replacement!After a year my vacuum broke. I took to the Dyson authorize center. I have been waiting 5 months for a replacement. Every month I was told my machine will be delivered within 5 to 7 business days. I am still waiting, as of August 15, 2022, my replacement is on its way.... 10 to 15 days."
307,1,"Very Disappointed--Terrible Vacuumhad great suction first few times, THEN downhill from there, wheels are hard to maneuver around easily tips over, we have short pile carpet, thick pile rugs, wooden floors and tiles, 3 cats and a Maltese, doesn't have enough suction to pick up everything even small things, reason hubby purchased this was to make things easier BUT definatly does not make life any more easier. this was our first Dyson then decided to get another Dyson V10 stick vacuum. Will NEVER purchase another Dyson."
