ID,Score,Review
0,5,"Absolutely love my Dyson UP16!Absolutely love my Dyson UP16! Purchased 2 years ago and only recently had trouble with it. A hole in a hose at the base of the unit and loss of suction. I called the Dyson helpline (conveniently listed on the machine! so I didn't need to google the number). The helpdesk lady was super helpful, took my details and booked the unit in to be serviced. The ladies at the service centre in Coopers Plains QLD were so friendly and made the whole experience easy and effortless. My Dyson was fixed under warranty and ready to be picked up 3 days later (they even offered to post it back at no cost!!). It now operates like a brand new machine again! Soo impressed with their service!!!"
1,5,"Great upright vacuum if you get it at the right priceI said I would never buy a Dyson Vac due to the price point always been too much for what they are. It's not like I don't mind spending the money for a good vacuum and I have spent close to a grand in the past on a high end wet and dry set up but it's just the Dyson product is highly overpriced IMO. But when I got the chance to buy a new light ball for only $360 I jumped and I am so far really happy with how it performs.
My old 15yo upright still works ok but hard to get bags for it now and the Dyson sure does find the dirt and cat hair it could never get up. The brush agitation is a high point for the dyson set up and it really performs well. Turning off the brush and then using it on hard floor surfaces is also great as I don't have to use the barrel vac anymore.

Canister is a bit on the small side but ok for what it is. Filters are easy to get too and clean as well.

The build quality leaves a bit to be desired with a bit too much flex in the handle and also when you pick it up to move it to another room the way the handle comes together means it will pull apart due to not having any firm way to lock down the handle parts so you need to watch that bit.

I feel the unit is far to plastic in its build quality in a negative way over other vacuums that feel far more solid and built to last a long time where with the dyson i think it will not get close to the other vacuums I have for service life.

Still hope I am wrong and will update my review if anything breaks on it.

The ball is a gimmick though and it is no better than other set ups. When you get used to how it moves it can be handy in certain tight corners but the way the handle flexes and the force needed at times to get the ball to go where you want it too means overall it's neither here or there."
2,5,"Do bother! Buy this one!(Title in reference to my last vacuum cleaner review)
This Dyson has excellent suction and comes with some pretty nifty tools, including a 2-in-1 crevice tool/brush attachment, mattress tool and dusting tool.
Honestly, it just does what you want it to, where and when you want it to!
The only disadvantage it has; and others have mentioned this, is that it does feel a little less solid compared to earlier Dyson uprights."
3,5,"Wonderful!This is a dream vacuum cleaner....light, easy to manoeuvre, and enough accessories to make cleaning an enjoyable task. Tried it in the shop and compared to my Miele it is so light!
Couldn’t believe how much fluff it picked up on my ‘so called clean carpets’"
4,5,"Good VacReplaced Hoover vacumn cleaner with dyson light ball upright had a similar one before,so far good bought as a result of a lot of resarch and reviews does leave some tracks in high weave carpet but otherwise good picks up pet hair lead is a bit tedious."
5,5,"Great Suction Easy to assembleI recently purchased an upright Dyson Light ball
Multi surface vacuum. I’ve had the barrel dyson in the past but thought the upright would be better hand height. The suction is amazing and the multi floor head works very well. It is a little heavy to push, so this may be a little negative vs the barrel option.
Overall I’m satisfied with this product."
6,5,"Dyson V15s - A Good VacThis is my fifth Dyson stick vacuum and with each model they improve. I didnt purchase this for the Submarine fitting, being more focussed on improved battery and performance. I have a house with three cats and a dog so pet hair is a problem, the floor is vinyl tiles, I found the green laser a god send in locating fur and other dust particles, the suction is very good and forward and back is adequate to pick up all particles. The unit came with an upright stand, it is a bit flimsy and I would have preferred the wall mount charging dock. The battery life is an improvement on my V10, I dont have any carpet so I cant comment on carpet performance.
I viewed a number of Youtube videos on the submarine attachment, this is not a wet and dry vacuum, there is no suction via the submarine attachment, it collect any particles and water in the submarine attachement, frankly I was suprised at some of the Youtube videos comparing the unit to wet and dry vacs, sucking up plates of spilt porridge, mounds of dirt and bowls of corn flakes, this attachment is simply for cleaning smooth floors, the wet roller runs over the floor and dirty water is squeezed into the waste collection, it cleaned adequately and the amount of effort and results was similar to my steam mop and left the same amount of water on the floor, filling and cleaning the submarine head is fiddly."
7,5,"Good Vacuum but Wet roller does not remove stain!Since I’m on a review spree, I thought I give my opinion on the new Dyson v15 detect submarine. I bought this when it came out last year and paid $1,549. The vacuum is very good, sucks up all the dust particles and dog fur very well which I love, however the wet roller does not remove stains or anything. It just glides on the floor and makes it wet pretty much. It’s also hard to get the water out of the fluffy mop and takes awhile for it to dry."
8,5,Great vacuum cleanerI've never really been a fan of dyson until now. The v15 detect vacuum with the submarine head is great. I can vacuum the whole house and then change the head over and mop the floors on 1 charge. This vacuum is great on pet hair too. I have carpet and vinyl floors
9,5,"Best investment ever!!!I’ve had v15 submarine for over a month and I have to say its the best investment I’ve ever made!!
I upgraded from the Dyson ball that I previously had and what a huge difference it’s been! I have two small kids so the house gets dirty fairly quickly. I use the vacuum daily. The battery time is perfect for my house (4 bedroom house with carpeting upstairs and hard floors downstairs). I can get the whole house done in one charge.
A bit about the vacuum: It come with various attachments. My favourite is the fluffy optic cleaner head!!!! It cleans hard floors with a green light that detects all the tiny particles that are invisible to the naked eye. Again wow. Love this tool!
There’s the Motorbar cleaner head for carpets. Compared to my previous Dyson, it is pulling so much dust from the carpets that I’m shocked. I’ve noticed my dust allergies improve since I bought this vacuum. Plus if I’m in a hurry I can quickly use it on hard floors as well.
Then there’s the Submarine head! I initially tossed with the idea of getting the v15 absolute detect instead of the v15 absolute detect submarine (which is the v15 plus the submarine head) but I ended up buying the submarine because it was on sale at the time. Compared to my previous Eufy wet n dry vac, again the cleaning is so good! While i have to vacuum first and then use the submarine head, I definitely prefer it this way because the cleaning is miles better! There are never any streaks left behind (hard floors or tiles) and and if find that I’ve gone over an area more than once and it’s wet, I simply roll the vacuum over it without turning it on and it dries up right away. Plus the clean up of the vacuum afterwards is a breeze. Just put the roller under running water and that’s it! It also comes with a drip tray, which is where I leave the submarine head once I’m done using it.
The vacuum comes with several other smaller tools. There’s the hair screw tool which I’ve regularly been using on my fabric and velvet sofas. It works amazingly! There’s also a combination tool which is great for the car. And the built in crevice tool to get in small narrrow places. I love that Dyson have it built into the main vacuum stick so you don’t have go looking for it when you need it. Simply take off the main stick and use it quickly.
Finally the floor dock. Love this feature because all the tools can stored on it while the vacuum charges and I won’t be misplacing any of them.
In terms on clean up the vacuum, besides the fluffy, everything can be opened up and washed easily.
The only negative: My hand does get tired from having to hold the power button while vacuuming. I wish Dyson had put a power button on the display screen instead. That said, I’ve done some research and there are several cheap options to buy a trigger lock so I don’t have to keep the button pressed down while vacuuming. Il be ordering one soon.
All in all, an amazing product that I would highly recommend!"
10,5,"It’s almost perfect!This is our 4th Dyson and the best so far
Waste bin size is great
Can vacuum a 390sqm home easily on one charge
Easy to assemble and use
Floor washing is brilliant - ensure the roller is wet before you start though.
Loses points as the crevice tool is stored in the neck of the vacuum reducing the size of waste traveling good up the tube. Had one blockage already.
Overall a great stick vacuum and would recommend"
11,5,Large bin and powerfulThis extra outsize Dyson will clean any large home without emptying the bin. It has 3 power suction settings with the medium setting giving about 45 minutes vacuuming time and the extra powerful Boost setting about 10 minutes. It comes with loads of accessories for every possible need. Once finished simply hang back in its wall charging bracket to recharge battery in quick time. 
12,5,"Too Much Fun(For those wondering like I was, the Absolute Extra package is the Outsize gold edition + stand.)
Purchased this on the advice of another Border Collie owner. I was struggling with the amount of hair I had to vacuum up each week (was using an older ball/barrel type). I was dubious because:
1. Dyson are expensive, and
2. Everyone says cordless stick vacs can't keep up

This one can. It absolutely can. The cannister size is a must for long-haired dog owners, as is the fur/hair attachment. It's also a stupid amount of fun to use. On ECO I get 45 minutes of vacuuming time. On Auto, I get 20-25 (mixed carpet/tile floors). On Boost I get 15 (I find 10 minutes every few days more than sufficient though, so I've never come close to running the battery down). It's a little heavier than its smaller counterpart (no surprises there), but you get used to it after a day or so. Also, having the stand is a nice addition.

My only gripe (and the reason for the 4/5 stars) is Dyson's approach to pricing. I ordered the vacuum a week before it went on sale on their website, $250 cheaper than if I'd waited seven days. Dyson refused to match, saying it's not policy. Okay, understandable, but still annoyed. Not annoyed enough to leave anything less than four stars though, because this vacuum really is amazing."
13,5,"Love it, powerful, great for large homes with petsJust purchased the Dyson Outsize Absolute Extra and have been using it for a week. We have a large house with over 280 square meters of living space with tiles and carpets. On first pass it filled the entire bin as per attached pic. I am very impressed with what it sucked out of the carpets as I was using a Meile corded vacuum (designed specifically for pets) and the new Dyson cordless picked up more debris from the carpets then a corded vacuum. As such, this is the first cordless vacuum that I would state as having the power of a corded vacuum. It also transitions seamlessly from hard floor to carpets. And more impressive is the anti tangle feature as I have 2 daughters with very long hair plus a dog and the hair did not wrap around the motor-bar roller which was a pet hate with the old Dyson v6 that has since died. Only drawback is that is that the unit is a little bulky and my wrist got a little tied after cleaning the entire house. And I'm still waiting for the extension hose which I'll use to clean the car. I bought the Dyson Outsize Absolute Extra recently for only $1250 with stand and the extension hose. I was also considering the v15 at $1499 but with the discount it was great value for money plus the Outsize is fantastic for large homes with pets. Battery life is excellent as I still had 50% remaining after vacuuming 280 square meters. And its very easy to maintain as you can remove the motor-bar roller in seconds as well as the main barrel from the main unit."
14,5,"Dyson Outsize - takes the chore out of vacumming!We purchased this vacuum for our timber laminate flooring. We liked the oversized head which covered the floor area in a quicker time. Along with the super strong suction and oversized catch bin it made the choice easy. We're definitely thrilled with the purchase and the whole house is done very quickly AND thoroughly!! It draws up the finest dirt particles and pet hair disappears in an instant!! Whilst it's a tad on the heavy side, that's to be expected with an oversize head & bin."
15,5,"Convenient, good suction but terrible batteryI really loved this vacuum. It is very convenient and easy to use. I used it for quick cleaning on coaches and inside my car. The battery did not last though. I bought a replacement battery, it only lasted a month.
Pros
- very handy
- convenient
- perfect quick and light vacuuming
- easy to clean and empty

Cons
- you have to keep holding the power button to operate
- battery did not last long"
16,5,"Perfect for a quick clean upI've owned mine for over 2 years and absolutely love it. On advice from my mum, I hardly ever use the max setting as this seems to affect the battery performance over time. It works perfectly fine on the normal setting and is very handy for a quick clean up around the house (tiles and carpet flooring). A single charge lasts for about 20 minutes of use and it charges fairly quickly."
17,5,High quality as expectedI live in a small studio apartment in the city. V7 trigger is small enough but packed a lot of power and can pick the small dust particles. I have tiles in the kitchen otherwise carpet so the v7 really helps a lot to get rid of the dust. It has 2 settings: high and max suction The only thing could be improved is that max suction will last for over a little 5 minutes otherwise whole charge will last me many days of using it. It does not have a fast charge. You may also need an extension hose accessory which you need to buy a separately so you can vacuum cuum those crevices and tight spaces.
18,5,Good suctionIt has a good suction and it is easy to clean. Easy to through the rubbish and dust in the compartment. Overall I like it very much but the charge doesn’t last long. I use it with high power and last only 6minutes. But it’s good enough for me.
19,5,"Your carpet isn't clean until you use this DysonWe thought the old Hoover wasn't cleaning properly, it had good suction but seemed to leave a lot of fur and stuff behind. Bought this Dyson and never thought we had so much hair, fluff and dirt still in the carpet. We have a large rug and it looks like new now, could not be happier with this vacuum, especially when compared to those expensive stick vacs."
20,5,"This is a life changing cleaning machine!I've had this for a week now - when it first arrived I used my old vac first, so I could see what else came out of the carpets, and it was a LOT. I have 2 dogs - one with long black fur and one with short black and white fur - and it is everywhere. The Dyson didn't skip a beat - it just sucked it all up, along with my hair and everything else - and it's so easy to empty. I had read reviews that it's heavy - well, it's not (I'm used to carrying 25kg bags of chook food, so this is less than half that). It's easy to carry up the stairs, I love the fact that it is an upright, and it stands neatly in a corner, ready to remove fur at a moments notice. My previous vacuum was an expensive Electrolux pet vacuum that just moved the fur around and became clogged. This does what it promises after one or two swipes over any area. And it has pulled embedded dirt from between floorboards and even out of the grout between tiles. I would say that this is the best vacuum I've ever had - and it's especially good at preventing the floating rafts of fur I have become accustomed to floating across the floor since I became a dog person."
21,5,"This is the best vacuum cleaner I've ever!My previous vacuum cleaner of 10 years died, and I decided to replace it with the same brand.
This one is more powerful and easy to maneuver, I love the fact that the head is smaller and fits perfectly in smaller places. The cord is longer which means I can nearly do my whole house in one go! "
22,5,"BrilliantThis machine is worth its weight in gold. Easy to set up and use, it's quiet and cleans the floors beautifully. Bought a second dock from the Dyson website for surprisingly little, so it can do the top floor too, but the whole unit is so light you could easily just pick it up and plug it in on another floor Previously had a Roomba J9+ that I ended up returning and the whole unit was so heavy I couldn't get even lift it myself. This one is far, far superior."
23,5,"Perfect all rounder vacuum for the neat freakA great vacuum with the added convenience of a larger bin . The laser technology on the Motörhead is absolutely amazing ! I vacuumed with our old vac and then tried the gen5 outsize with the laser head and you wouldn’t believe how much dust our old vacuum left behind! The laser shows up the dirty floors and it’s easy to see after going over the floor with this product how effective it is at removing dust, dirt and even works superbly to remove all traces of pet hair. Works great on hard or soft floors, just attach the soft head for hard floors that are prone to scratches and your set. Comes with lots of handy little attachments for various uses. Very impressed with this machine and will continue using at home and also for our cleaning business."
24,5,"Surprisingly goodI have had this vacuum for a couple of months. It is used exclusively on hard floors (tiles), so I can't really comment how it would go on carpet.
I am quite happy with it's performance. It has an ""Auto"" setting for the suction level which provides for a reasonable run time and is effective for cleaning my floors.

On ""Turbo"" the suction is surprisingly strong for a stick vacuum, although on this setting run time is pretty short - perhaps 5 or 6 minutes only.

The machine is pretty quiet, it's fairly easy to use and seems well constructed.

On the minus side the vacuum (and it's wall mounted dock) are a bit bulky, and the dock is slightly awkward to position the vacuum on.

I took one star off for the fact that the self cleaning brush roll function really doesn't work. You still need to manually remove the brush roll and pull / cut away any tangled hair. At least the brush roll is easy to remove, with no tools needed (although the metal retaining spring that sits over it is hard to open and even harder to snap closed).

Overall I am quite happy with this vacuum - particularly at the price paid of $284.

Recommended."
25,5,"Can't live without my robotMy robot cleans every day and it's amazing how much she picks up when you think your place is clean. I have hard floors and a few mats, a couple of small steps and she manages incredibly well. Custom service is spot on."
26,5,"Love the Electrolux UltimateHome 700 vacuum cleanerI want to buy a cheap vaccum cleaner to support my Dyson stick vacuum as it only lasts about 20 minutes and to get into difficult spots that the Dyson can’t. I did not want to spend more than $300.
I saw the UltimateHome 700 at the Good Guys. The vaccum looks cheap and nasty but don’t let that fools you.

Instead of using my Dyson, I made the decision to try out the new vaccum cleaner and I was surprise and shock how much dirt was in the dust bin.

Best investment I ever made."
27,5,"Excellent robot vacuumHave had this i9.2 (Animal edition) running for a few weeks now, and it does an amazing job on our all lino floored living area.
Once it has 'learned' the floor mapping, it is super easy to break the map up into zones, and size them to be done in a single battery charge. Best life from battery so far is around 45 minutes, and it cleans around 45sq meters of hard floor.

The 0.7 litre bin is plenty for our usage, and is very easy to clean. The dust filter is protected by a mesh screen inside the bin as well, and animal hair is easily removed.

The app (Electrolux 'Wellbeing') is excellent, and very easy to use on iOS.

Pro's - Small and triangle means it gets into corners and around office chairs well.
- excellent cleaning on hard floors.
- good bin size, and easy to clean.
- battery life is fine, recharges quickly.
- excellent at navigating, very gentle.

Con - is very sensitive to height, and wont go under the couch despite having plenty of clearance. I cant find a setting to change that. Would have been 5 star review otherwise.

Purchased from HN - $650 or so - the Animal version is a bit more than the version listed at top of page.

Very impressed, highly recommended."
28,5,"It Does What Its Supposed ToWe replaced the equivalent Bosch rechargeable with this. Much better! LED is very handy for showing up dirt, the service duration is good after a full charge, and its easy to empty and clean. Useful as a hand-held too."
29,5,"Effective cleaning and amazing battery lifeWe got this vacuum as a replacement under a warranty claim from Electrolux (who were great to deal with). The old version which died was a well loved machine in our house and this newer model does not disappoint.
The battery lasts long enough to vacuum our largeish two storey house including carpet, tiles and hardwood floors.
The machine is very maneuverable and the LED lights on the head help to track down otherwise invisible dust in low light.
The canister is easy to empty and always contains a pleasing yet slightly disturbing amount of dust, hair and grime.
The detachable hand unit is great for cleaning the inside of the car and probably does 80% as good a job as our much larger plug in Electrolux ultra silencer vacuum.
The vacuum comes with a lot of attachments we haven't used yet, but we are looking forward to deploying it to get rid of dust on our wooden Venetian blinds.
Highly recommended unit and amazing value for the usual purchase price."
30,5,"Excellent choiceI have a Hoover Vortex Pro that is awful. So, buying a stick vacuum for my daughter I did a lot of research before buying and am very happy with my choice. It is light and easy to use. The hand held unit clips in and out smoothly. Cleans effectively, quiet, the swivel head is really good, light is handy and the battery lasts well. It is easy to empty the dirt chamber (Hoover is impossible) and clean the filter, and we are amazed how much dirt it picks up, and we are clean people! Definitely recommend to buy this one."
31,5,"Finally a stick vacuum with a useful crevice tool! 5 STARS!Our 5 year old cordless stick vacuum battery died. As we were so happy with the model and after a lot a research on other brands, we decided to stay with the same model mainly for the swivel head. I waited patiently for the unit to come on sale, so we saved almost $100.
We were pleasantly surprised with all the new tools that came with this
Ergorapido 18V cordless vacuum. The old one had only the mini useless crevice tool.

The new long crevice tool actually does fit in the window tracks. Hallelujah finally one that fits!

I have taken a photo to compare to the Dyson v11 crevice tool which is too wide to fit into window tracks.

Instructions are more Ikea like, in other words, no words! No online manual either.

Without instructions, with the old unit we did not realise for 2 years that the crevice tool was stored in the charging unit. Same for the new model. See photo.

DO NOT be persuaded to buy the 14v model to save money. You need the extra sucking power of the 18v model which is the one I am reviewing.

This improved model has a larger window to see if the barrel needs to be emptied. I like that.

Love the charging stand. Another reason for buying this brand."
32,5,"Great machine!Excellent for quick vacuums and more! Just become familiar with cleaning the filters. ( have a spare or 3!). And beware of hair in the head. Remove it and cut any hair off. I own two of them.
Garry."
33,5,"Great Second VacThis a great second vacuum for everyday use. We get the main cleaner out periodically for a deeper clean though this is less often now. If the speed with which the canister fills is anything to go by it does a good job on both hard floors and carpets. It's size and manoeuvrability makes it great for tight and low clearance and stairs. It has plenty of charge for the way we use it. Emptying the canister is easy. It is well-built and doesn't take up much space when not it use. Better than I expected, this is a perfect ""between deep clean"" vacuum."
34,5,"Excellent suction but the cord does not retract!!Fantastic suction I use it on carpet and tiles, it literally lifts the carpet up it is that good! It has lifted out a lot of dirt and dust even after I used my Dyson! It's very light and easy to move around. The only issue is that my cord will not retract!! Very annoying."
